keyword,hashtag,count_hashtag,date
ผลบอล,ผลบอล,21,03/04/2022
ผลบอล,ข่าวกีฬา,11,03/04/2022
ผลบอล,แทงบอล,10,03/04/2022
ผลบอล,แทงบอลสด,10,03/04/2022
ผลบอล,ผลบอลวันนี้,10,03/04/2022
ผลบอล,ผลบอลสด,10,03/04/2022
ผลบอล,ข่าวฟุตบอล,10,03/04/2022
ผลบอล,บ้านผลบอล,10,03/04/2022
ผลบอล,แทงบอลออนไลน์,10,03/04/2022
ผลบอล,คมชัดลึก,5,03/04/2022
ผลบอล,ช้างศึก,3,03/04/2022
ผลบอล,thailand,3,03/04/2022
ผลบอล,ฟุตซอลไทย,3,03/04/2022
ผลบอล,ฟุตซอลทีมชาติไทย,3,03/04/2022
ผลบอล,ฟุตซอลชิงแชมป์อาเซียน,3,03/04/2022
ผลบอล,ฟุตซอล,3,03/04/2022
ผลบอล,บอลไทย,3,03/04/2022
ผลบอล,futsalthailand,3,03/04/2022
ผลบอล,changsueklive,3,03/04/2022
ผลบอล,afffutsalchampionship,3,03/04/2022
ผลบอล,เบิร์นลีย์,2,03/04/2022
ผลบอล,พรีเมียร์ลีกอังกฤษ,2,03/04/2022
ผลบอล,แมนเชสเตอร์ซิตี้,2,03/04/2022
ผลบอล,บุนเดสลีกาเยอรมัน,2,03/04/2022
ผลบอล,บาเยิร์นมิวนิค,2,03/04/2022
ผลบอล,ไฟร์บวร์ก,2,03/04/2022
ผลบอล,ทีเด็ดบอลเต็ง,1,03/04/2022
ผลบอล,เรอัลมาดริด,1,03/04/2022
ผลบอล,โปรแกรมบอล,1,03/04/2022
ผลบอล,premierleague,1,03/04/2022
ผลบอล,ข่าวบอล,1,03/04/2022
ผลบอล,ข่าวบอลวันนี้,1,03/04/2022
ผลบอล,ฐานเศรษฐกิจ,1,03/04/2022
ผลบอล,เอฟเอคัพ,1,03/04/2022
ผลบอล,ดูบอลสด,1,03/04/2022
ผลบอล,ทีเด็ดบอลสเต็ป,1,03/04/2022
ผลบอล,บอลสด,1,03/04/2022
ผลบอล,อาร์โต๊ะถล่มโต๊ะ,1,03/04/2022
ผลบอล,ลาลีกาสเปน,1,03/04/2022
ผลบอล,ทีเด็ดถล่มโต๊ะ,1,03/04/2022
ผลบอล,ทีเด็ดบอลชุด,1,03/04/2022
ผลบอล,ทีเด็ดบอลวันนี้,1,03/04/2022
ผลบอล,เซลต้าบีโก้,1,03/04/2022
