keyword,hashtag,count_hashtag,date
#อาร์เซน่อล,อาร์เซน่อล,6,28/04/2022
#อาร์เซน่อล,พรีเมียร์ลีก,2,28/04/2022
#อาร์เซน่อล,แทมมี่อับราฮัม,2,28/04/2022
#อาร์เซน่อล,shotongoal,1,28/04/2022
#อาร์เซน่อล,โกปาเดอเรย์,1,28/04/2022
#อาร์เซน่อล,แมนซิตี้,1,28/04/2022
#อาร์เซน่อล,เอคตอร์เบเยริน,1,28/04/2022
#อาร์เซน่อล,เรื่องข่าวเรื่องใหญ่,1,28/04/2022
#อาร์เซน่อล,เรอัลเบติส,1,28/04/2022
#อาร์เซน่อล,เชซุส,1,28/04/2022
#อาร์เซน่อล,ลีดส์ยูไนเต็ด,1,28/04/2022
#อาร์เซน่อล,ลาลีกาสเปน,1,28/04/2022
#อาร์เซน่อล,ลาลีกา,1,28/04/2022
#อาร์เซน่อล,ฟาบริซิโอโรมาโน่,1,28/04/2022
#อาร์เซน่อล,pptvhd36,1,28/04/2022
#อาร์เซน่อล,นาฮูเอลโมลิน่า,1,28/04/2022
#อาร์เซน่อล,ท็อตแน่มฮอตสเปอร์,1,28/04/2022
#อาร์เซน่อล,ทาเคฮิโระโทมิยาสุ,1,28/04/2022
#อาร์เซน่อล,ช่อง36,1,28/04/2022
#อาร์เซน่อล,ข่าวฟุตบอลวันนี้,1,28/04/2022
#อาร์เซน่อล,ข่าวฟุตบอล,1,28/04/2022
#อาร์เซน่อล,ข่าวกีฬาวันนี้,1,28/04/2022
#อาร์เซน่อล,ข่าวกีฬา,1,28/04/2022
#อาร์เซน่อล,sportbarupdate,1,28/04/2022
#อาร์เซน่อล,sportbaronline,1,28/04/2022
#อาร์เซน่อล,sportbar,1,28/04/2022
#อาร์เซน่อล,smmsport,1,28/04/2022
#อาร์เซน่อล,โรม่า,1,28/04/2022
